{
  "endpoints": [
    {
      "url": "https://podr-svc-48579879001.us-west4.run.app/?q=toppodcasts&limit=10",
      "outputFile": "top-podcasts.json",
      "inlineAsVariable": true,
      "variableName": "PODR_TOP_PODCASTS",
      "fallbackData": {
        "feed": {
          "entry": []
        }
      }
    }
  ],
  "inlineAsVariable": true,
  "saveAsFile": true,
  "requestTimeout": 15000,
  "retryCount": 3
}